{
  "asset_count": 9,
  "collection_failure_count": 0,
  "group_count": 3,
  "grouping_rule": "package_parent_first_3_segments",
  "groups": [
    {
      "approved_exception_count": 0,
      "asset_count": 4,
      "asset_paths": [
        "/Game/UABAMaterialDemo/02_RenderState/M_UABA_PostProcess.M_UABA_PostProcess",
        "/Game/UABAMaterialDemo/02_RenderState/M_UABA_Translucent.M_UABA_Translucent",
        "/Game/UABAMaterialDemo/02_RenderState/M_UABA_TwoSidedAdditive.M_UABA_TwoSidedAdditive",
        "/Game/UABAMaterialDemo/02_RenderState/M_UABA_UnlitTranslucent.M_UABA_UnlitTranslucent"
      ],
      "collection_failure_count": 0,
      "fix_required_count": 0,
      "group_label": "02_RenderState",
      "group_path": "/Game/UABAMaterialDemo/02_RenderState",
      "hotspot_rank": 1,
      "hotspot_reason": "每个对象 1.25 条规则问题",
      "issue_asset_count": 4,
      "issue_count": 5,
      "issue_density": 1.25,
      "passed_asset_count": 0,
      "risk_band": "高密度",
      "unreviewed_issue_count": 5
    },
    {
      "approved_exception_count": 0,
      "asset_count": 3,
      "asset_paths": [
        "/Game/UABAMaterialDemo/01_Approved/MI_UABA_BasicSurface.MI_UABA_BasicSurface",
        "/Game/UABAMaterialDemo/01_Approved/M_UABA_BasicSurface.M_UABA_BasicSurface",
        "/Game/UABAMaterialDemo/01_Approved/M_UABA_SimpleOpaque.M_UABA_SimpleOpaque"
      ],
      "collection_failure_count": 0,
      "fix_required_count": 0,
      "group_label": "01_Approved",
      "group_path": "/Game/UABAMaterialDemo/01_Approved",
      "hotspot_rank": 2,
      "hotspot_reason": "未触发规则问题",
      "issue_asset_count": 0,
      "issue_count": 0,
      "issue_density": 0.0,
      "passed_asset_count": 3,
      "risk_band": "清洁",
      "unreviewed_issue_count": 0
    },
    {
      "approved_exception_count": 0,
      "asset_count": 2,
      "asset_paths": [
        "/Game/UABAMaterialDemo/03_ParentChain/MI_UABA_ShapeInstance.MI_UABA_ShapeInstance",
        "/Game/UABAMaterialDemo/03_ParentChain/M_UABA_ShapeMaster.M_UABA_ShapeMaster"
      ],
      "collection_failure_count": 0,
      "fix_required_count": 0,
      "group_label": "03_ParentChain",
      "group_path": "/Game/UABAMaterialDemo/03_ParentChain",
      "hotspot_rank": 3,
      "hotspot_reason": "未触发规则问题",
      "issue_asset_count": 0,
      "issue_count": 0,
      "issue_density": 0.0,
      "passed_asset_count": 2,
      "risk_band": "清洁",
      "unreviewed_issue_count": 0
    }
  ],
  "issue_count": 5,
  "ranking_rule": "采集失败 > 需修复 > 问题密度 > 问题数 > 目录路径",
  "report_id": "material-report-ba9f3369729b6fbc",
  "review_orphan_count": 0,
  "schema_version": "unreal-audit-delivery-groups@1.0.0",
  "unbound_issue_count": 0
}
